{
  "_type": "https://in-toto.io/Statement/v1",
  "subject": [
    {
      "name": "guest",
      "digest": {
        "blake3": "2adca3e7ca42d7415a5227a20002baad90047d087249cbb9ea36e557f5a4a380",
        "sha256": "dcf53677c7c80636f8fc2247676b8f747d1549ce4af742c8505eb0f0ae334c03"
      }
    }
  ],
  "predicateType": "https://uor.foundation/prism/replay/v1",
  "predicate": {
    "runtime": {
      "name": "prism-code",
      "version": "0.3.0"
    },
    "model": {
      "blake3": "e76544838a98c46341ed8807f72897ec68de5a8a9bf28721738a76761c9df90e",
      "sha256": "074921890f5c372c89f4ed794d26dd550231d5e9bf99bf9474cc1a78923292c6"
    },
    "histories": [
      {
        "digest": {
          "blake3": "507d9bdf6de96117e3823f6614ed3f24544d6a4224e2ef0637f2057dfbafce98",
          "sha256": "56d4c9c4bcf9f5c26fecd78d9709f9e3caef761d76f9a13ab94d7c31fe92ad1a"
        },
        "events": 22,
        "divergences": 0
      }
    ],
    "divergenceCount": 0
  }
}
